{
  "$schema": "./schema.json",
  "lang": "fa",
  "language": "ูุงุฑุณ",
  "dir": "rtl",
  "shared": {
    "chooseYorLanguage": "ุฒุจุงูุชุงู ุฑุง ุงูุชุฎุงุจ ฺฉูุฏ",
    "failMongodbConnection": "ุงุชุตุงู ุจู ูพุงฺฏุงู ุฏุงุฏู ูุงูููู ุจูุฏ.",
    "next": "ุจุนุฏ",
    "previous": "ูุจู",
    "mongodbUri": "Mongodb URL",
    "fillForm": "ูุทูุง ููุฏูุง ูุงุฒู ุฑุง ูพุฑ ฺฉูุฏ.",
    "dbError": "ุฎุทุง ูพุงฺฏุงู ุฏุงุฏู.",
    "login": "ูุงุฑุฏ ุดูุฏ"
  },
  "installer": {
    "title": "ูุตุจ ุงููู",
    "chooseLanguage": " ุฒุจุงู",
    "steps": {
      "admin": { "title": "ุณุงุฎุช ูุฏุฑ" },
      "finish": {
        "title": "ูพุงุงู",
        "description": "ูพฺฉุฑุจูุฏ ุจุง ููููุช ุงูุฌุงู ุดุฏ ๐ฅณ"
      },
      "dashboard_lang": { "title": "ุฒุจุงู ุดูุง" },
      "db": { "title": "ูพุงฺฏุงู ุฏุงุฏู" },
      "suported_lang": { "title": "ุฒุจุงูโูุง ุณุงุช" }
    }
  },
  "input": { "combobox": { "placeholder": "ุงูุชุฎุงุจ ฺฉูุฏ" } },
  "user": {
    "fName": { "title": "ูุงู", "required_error": "ูุทูุง ูุงู ุฑุง ูุงุฑุฏ ฺฉูุฏ." },
    "lName": {
      "title": "ูุงู ุฎุงููุงุฏฺฏ",
      "required_error": "ูุทูุง ูุงู ุฎุงููุงุฏฺฏ ุฑุง ูุงุฑุฏ ฺฉูุฏ."
    },
    "email": {
      "title": "ุงูู",
      "required_error": "ูุทูุง ุงูู ุฑุง ูุงุฑุฏ ฺฉูุฏ.",
      "valid_error": "ูุทูุง ุงูู ูุนุชุจุฑ ูุงุฑุฏ ฺฉูุฏ."
    },
    "mobile": {
      "title": "ููุจุงู",
      "required_error": "ูุทูุง ููุจุงู ุฑุง ูุงุฑุฏ ฺฉูุฏ."
    },
    "password": {
      "title": "ุฑูุฒ ูุฑูุฏ",
      "required_error": "ูุทูุงู ุฑูุฒ ูุฑูุฏ ุฑุง ูุงุฑุฏ ฺฉูุฏ.",
      "min_error": "ุฑูุฒ ูุฑูุฏ ุจุงุฏ ุญุฏุงูู ถ ฺฉุงุฑุงฺฉุชุฑ ุจุงุดุฏ."
    },
    "confirmPassword": {
      "title": "ุชฺฏุฑุงุฑ ุฑูุฒ ูุฑูุฏ",
      "required_error": "ูุทูุง ุชุงุฏ ุฑูุฒ ูุฑูุฏ ุฑุง ูุงุฑุฏ ฺฉูุฏ.",
      "dontEqual_error": "ุชุงุฏ ุฑูุฒ ุนุจูุฑ ุจุง ุฑูุฒ ุนุจูุฑ ุจุฑุงุจุฑ ูุณุช."
    },
    "createSuccessful": "ฺฉุงุฑุจุฑ ุจุง ููููุช ุงุฌุงุฏ ุดุฏ."
  },
  "languages": {
    "locales": {
      "title": "ุฒุจุงูโูุง ุณุงุช",
      "placeholder": "ุฒุจุงูโูุง ุณุงุช ุฑุง ุงูุชุฎุงุจ ฺฉูุฏ...",
      "required_error": "ูุทูุง ุฒุจุงูโูุง ุณุงุช ุฎูุฏ ุฑุง ุงูุชุฎุงุจ ฺฉูุฏ."
    },
    "siteDefault": {
      "title": "ุฒุจุงู ูพุด ูุฑุถ",
      "placeholder": "ุฒุจุงู ูพุดโูุฑุถ ุณุงุช ุฑุง ุงูุชุฎุงุจ ฺฉูุฏ...",
      "required_error": "ูุทูุง ุฒุจุงู ูพุดโูุฑุถ ุณุงุช ุฎูุฏ ุฑุง ุงูุชุฎุงุจ ฺฉูุฏ."
    },
    "success": "ุฒุจุงูโูุง ุจุง ููููุช ุชูุธู ุดุฏูุฏ."
  }
}
